{
  "testRunId": "run-official-react-500-linux",
  "timestamp": "2026-08-17T21:41:30.296Z",
  "framework": "React 19",
  "frameworkVersion": "19.0.0",
  "platform": {
    "os": "Arch Linux x86_64 (Kernel 6.10.x / Gamescope Session)",
    "displayServer": "Wayland / DRM-KMS Direct",
    "webview": "WebKitGTK 2.44.3",
    "resolution": "1920x1080 @ 60Hz"
  },
  "datasetSize": 500,
  "virtualizationEnabled": false,
  "spatialNavMode": "agnostic",
  "inputArchitecture": "gamepad_api",
  "metrics": {
    "startup": {
      "timeToFirstInteractiveMs": 86.3,
      "coldStartMs": 129.5
    },
    "frameStats": {
      "fpsAverage": 58.9,
      "fps1PercentLow": 46.2,
      "frameTimeP50Ms": 16.6,
      "frameTimeP95Ms": 18.4,
      "frameTimeP99Ms": 23.5,
      "framesAbove16_67ms": 42,
      "framesAbove33_33ms": 3,
      "framesAbove50ms": 0,
      "totalFramesSampled": 1200,
      "durationMs": 20000
    },
    "memory": {
      "osProcessRssMb": 76.8,
      "osPrivateWorkingSetMb": 59.9,
      "jsHeapUsedMb": 24.8
    },
    "soakTest30Min": {
      "rssMemoryDeltaMb": 1.5,
      "fpsDegradationPercent": 0.24,
      "activeListenersCount": 2,
      "focusLossOccurrences": 0
    },
    "modalLeakTest500Cycles": {
      "rssMemoryBeforeMb": 76.8,
      "rssMemoryAfterMb": 77.5,
      "retainedDetachedDomNodes": 0
    },
    "dataOperations": {
      "itemCount": 10000,
      "filterDurationMs": 2.7332000000000107,
      "sortDurationMs": 0.3272999999999797
    },
    "bundle": {
      "jsRawKb": 1544.4,
      "jsGzipKb": 116.6,
      "cssRawKb": 9.9,
      "cssGzipKb": 2.7,
      "tauriStandaloneBinaryMb": 13.9,
      "installerPackageMb": 6.9,
      "totalInstalledFootprintMb": 15.4
    },
    "maintainability": {
      "linesOfCode": 766,
      "fileCount": 11,
      "cyclomaticComplexityScore": 2.1,
      "extensionTestLocAdded": 28,
      "extensionTestFrictionNotes": "Virtual DOM estándar. Mayor consumo de memoria y ciclos de reconciliación en listas grandes de 500 nodos sin virtualizar."
    }
  }
}