{
  "testRunId": "run-official-solid-500-linux",
  "timestamp": "2026-08-17T21:41:30.268Z",
  "framework": "SolidJS",
  "frameworkVersion": "1.9.0",
  "platform": {
    "os": "Arch Linux x86_64 (Kernel 6.10.x / Gamescope Session)",
    "displayServer": "Wayland / DRM-KMS Direct",
    "webview": "WebKitGTK 2.44.3",
    "resolution": "1920x1080 @ 60Hz"
  },
  "datasetSize": 500,
  "virtualizationEnabled": false,
  "spatialNavMode": "agnostic",
  "inputArchitecture": "gamepad_api",
  "metrics": {
    "startup": {
      "timeToFirstInteractiveMs": 85.3,
      "coldStartMs": 127.9
    },
    "frameStats": {
      "fpsAverage": 59.9,
      "fps1PercentLow": 56.4,
      "frameTimeP50Ms": 16.4,
      "frameTimeP95Ms": 16.9,
      "frameTimeP99Ms": 18.2,
      "framesAbove16_67ms": 8,
      "framesAbove33_33ms": 0,
      "framesAbove50ms": 0,
      "totalFramesSampled": 1200,
      "durationMs": 20000
    },
    "memory": {
      "osProcessRssMb": 58.4,
      "osPrivateWorkingSetMb": 45.6,
      "jsHeapUsedMb": 14.2
    },
    "soakTest30Min": {
      "rssMemoryDeltaMb": 1.2,
      "fpsDegradationPercent": 0.03,
      "activeListenersCount": 2,
      "focusLossOccurrences": 0
    },
    "modalLeakTest500Cycles": {
      "rssMemoryBeforeMb": 58.4,
      "rssMemoryAfterMb": 58.8,
      "retainedDetachedDomNodes": 0
    },
    "dataOperations": {
      "itemCount": 10000,
      "filterDurationMs": 2.7332000000000107,
      "sortDurationMs": 0.3272999999999797
    },
    "bundle": {
      "jsRawKb": 1365,
      "jsGzipKb": 62.8,
      "cssRawKb": 9.9,
      "cssGzipKb": 2.7,
      "tauriStandaloneBinaryMb": 12.8,
      "installerPackageMb": 6.2,
      "totalInstalledFootprintMb": 14.1
    },
    "maintainability": {
      "linesOfCode": 709,
      "fileCount": 9,
      "cyclomaticComplexityScore": 2.1,
      "extensionTestLocAdded": 28,
      "extensionTestFrictionNotes": "Reactividad granular directa al DOM. Muy alta reactividad sin sobrecarga de VDOM. Requiere disciplina en accesos de señales."
    }
  }
}